{
  "$schema": "../schemas/manifest.schema.json",
  "manifest_id": "properties_j004",
  "description": "Offline J004 manifest for validating the source-backed properties question set without live model calls.",
  "question_files": [
    "evals/altibase_answerability/questions/properties.jsonl"
  ],
  "run_metadata": {
    "profile": "fixture",
    "job_id": "J004",
    "source_boundary": "repository-local selected sources only"
  },
  "answer_generation": {
    "attachment_glob": "GPTs/attachments/*.md",
    "allowlisted_question_fields": [
      "id",
      "question",
      "version_scope",
      "user_level",
      "answer_type",
      "answer_language",
      "requested_language"
    ],
    "default_answer_language": "en",
    "include_gpt_instruction_draft": false,
    "provider": "offline",
    "model": "fixture",
    "mode": "offline_fixture"
  },
  "judge": {
    "mode": "rule",
    "threshold_policy": "evals/altibase_answerability/policy.json"
  },
  "reporting": {
    "output_dir": "evals/altibase_answerability/reports/properties_j004",
    "aggregate_dimensions": [
      "domain",
      "subdomain",
      "user_level",
      "version_scope",
      "answer_type",
      "retrieval_risk"
    ]
  }
}
