{
  "$schema": "../schemas/manifest.schema.json",
  "manifest_id": "targeted_calibration_j019_instruction",
  "description": "J019 calibration manifest for targeted answerability checks that include the GPT instruction draft in the answer-generation prompt. Use --question-id to select representative failed questions.",
  "question_files": [
    "evals/altibase_answerability/questions/properties.jsonl",
    "evals/altibase_answerability/questions/sql_ddl_dml_datatypes.jsonl",
    "evals/altibase_answerability/questions/operations_admin.jsonl",
    "evals/altibase_answerability/questions/views_performance_monitoring.jsonl",
    "evals/altibase_answerability/questions/replication_cdc_security_network.jsonl",
    "evals/altibase_answerability/questions/errors_troubleshooting.jsonl",
    "evals/altibase_answerability/questions/tools_apis_connectors_migration.jsonl"
  ],
  "run_metadata": {
    "profile": "targeted_calibration",
    "job_id": "J019",
    "source_boundary": "repository-local selected sources only"
  },
  "answer_generation": {
    "attachment_glob": "GPTs/attachments/*.md",
    "allowlisted_question_fields": [
      "id",
      "question",
      "version_scope",
      "user_level",
      "answer_type",
      "answer_language",
      "requested_language"
    ],
    "default_answer_language": "en",
    "include_gpt_instruction_draft": true,
    "gpt_instruction_draft_path": "GPTs/GPT_Instructions_Draft.md",
    "provider": "offline",
    "model": "fixture",
    "mode": "dry_run"
  },
  "judge": {
    "mode": "rule",
    "threshold_policy": "evals/altibase_answerability/policy.json"
  },
  "reporting": {
    "output_dir": "evals/altibase_answerability/reports/targeted_calibration_j019",
    "aggregate_dimensions": [
      "domain",
      "subdomain",
      "user_level",
      "version_scope",
      "answer_type",
      "retrieval_risk"
    ]
  }
}
